[
  {
    "key": "bb2",
    "url": "mapbox://route-project.28u0jygh",
    "layer": "hmilnik-1xdu96",
    "hubs": ["Вінницький"],
    "enabled": true
  },
  {
    "key": "06s",
    "url": "mapbox://route-project.bv9r5t6a",
    "layer": "uarushiv-1602z5",
    "hubs": ["Вінницький"],
    "enabled": true
  },
  {
    "key": "61a",
    "url": "mapbox://route-project.cwrw3fvi",
    "layer": "tomashpil-14pg1k",
    "hubs": ["Вінницький"],
    "enabled": true
  },
  {
    "key": "62a",
    "url": "mapbox://route-project.dfky75m6",
    "layer": "sklad-0knlqz",
    "hubs": ["МХП"],
    "enabled": true
  },
  {
    "key": "63a",
    "url": "mapbox://route-project.04u4bn8m",
    "layer": "vin_hub1-d77dfz",
    "hubs": ["Вінницький"],
    "enabled": true
  },
  {
    "key": "64a",
    "url": "mapbox://route-project.bym769jm",
    "layer": "elevator2-7kdj7j",
    "hubs": ["МХП"],
    "enabled": true
  },
  {
    "key": "65a",
    "url": "mapbox://route-project.5m3es1zq",
    "layer": "let-agro-bar-2cw520",
    "hubs": ["МХП"],
    "enabled": true
  }
]
